{
  "schema_version":"0.1","name":"static_sprites","seed":1337,
  "world":{"capacity":1000},"camera":{"position":[0,0],"half_extent":[16,9]},
  "textures":[{"id":"sprite","kind":"checker","width":8,"height":8,"cell_size":2,"color":[1,0.2,0.1,1],"color2":[1,0.8,0.2,1]}],
  "spawn_groups":[{"id":"grid","count":1000,"placement":{"kind":"grid","origin":[-15,-8],"spacing":[0.5,0.5],"columns":64},"transform":{"scale":[0.35,0.35]},"sprite":{"texture":"sprite","size":[0.35,0.35],"tint":[1,1,1,1],"layer":0}}],
  "systems":[],"benchmark":{"runs":3,"warmup_frames":30,"measurement_frames":200}
}
