{
  "schema_version":"0.1","name":"moving_sprites","seed":424242,
  "world":{"capacity":1000},"camera":{"position":[0,0],"half_extent":[16,9]},
  "textures":[{"id":"sprite","kind":"solid","width":4,"height":4,"color":[0.1,0.7,1,1]}],
  "spawn_groups":[{"id":"movers","count":1000,"placement":{"kind":"grid","origin":[-15,-8],"spacing":[0.5,0.5],"columns":64},"transform":{"rotation":0,"scale":[0.3,0.3]},"velocity":{"linear":[0.7,0.25],"angular":0.2},"sprite":{"texture":"sprite","size":[0.3,0.3],"pivot":[0.5,0.5],"tint":[1,1,1,1],"layer":0,"visible":true}}],
  "systems":[
    {"id":"integrate","operation":"integrate_velocity","phase":"fixed_update","parameters":{"delta_seconds":0.016666667},"expected_access":{"query":["Transform2D","Velocity2D"],"reads":["Transform2D","Velocity2D"],"writes":["Transform2D"]}},
    {"id":"wrap","operation":"wrap_bounds","phase":"fixed_update","after":["integrate"],"parameters":{"bounds":{"min":[-16,-9],"max":[16,9]}}}
  ],
  "benchmark":{"runs":3,"warmup_frames":30,"measurement_frames":200}
}
